,title,link,date,news
738,"식약처, &apos;함께하는 식품안전, 건강한 대한민국&apos; 식품안전의 날 기념식",http://www.aflnews.co.kr/news/articleView.html?idxno=144101,2018.05.14,"['\n식품의약품안전처는 제 17회 식품안전의 날(5월 14일)을 맞이해 지난 11일 서울 광화문 광장에서 ‘함께하는 식품안전, 건강한 대한민국’을 주제로 기념식을 가졌다.이날 기념식에는 이낙연 국무총리과 류영진 식약처장, 이창환 한국식품산업협회장, 탐 하일런트 국제식품규격위원회(CODEX) 사무국장을 비롯해 소비자 단체 대표, 제외국 식품기관 전문가 등이 참석했다.또한 식품산업과 사회 발전에 공헌한 권훈정 서울대 교수에게 녹조근정훈장, 손정숙 대한영양사협회 전 사무총장과 문성기 코스맥스비티아이 대표에게 산업포장, 노중섭 해태제과 팀장 등 5명에게 대통령 표창 등 각계 인사 총 198명에게 훈·포장 및 표창이 수여됐다.류 처장은 환영사를 통해 “식품안전의 날은 식품안전에 대한 국민적 관심을 환기시키고 식품 관련 종사자들의 안전의식을 촉구함으로써 식품안전 사고 예방과 국민보건 향상을 위해 지정됐다”며 “식품안전의 중요성에 대한 인식이 지속적으로 확산되길 희망하며 식약처는 국민들이 안심하고 먹거리를 섭취할 수 있도록 관련 노력을 지속하겠다”고 밝혔다.이 총리는 “우리나라가 세계보건기구의 식품안전평가에서 최고점을 받았지만 식품안전관리는 그 끝이 없다”며 “정부는 국민건강을 위해 식품안전관리를 최상으로 끌어올리고, 유관기관과 단체와의 협조를 통해 안전한 먹거리 공급을 위해 앞장서겠다”고 말했다.\xa0아울러 광화문 광장에서는 쿠킹클래스 등 건강한 식생활 체험, 식중독 예방 및 HACCP(식품안전관리인증기준) 3D 체험관, 주류 이물저감화 캠페인, 식품산업체 등이 운영하는 먹거리 제공 부스 등 전 국민이 참여할 수 있는 식품안전박람회(5월11~12일)가 개최됐다. ']"
739,안전한 급식 식재료 공급의 한 축 담당할 것,http://www.aflnews.co.kr/news/articleView.html?idxno=144095,2018.05.14,"['\n한국농수산식품유통공사(aT)는 지난 9일 학교급식 식재료 공급업체 현장 관리를 위한 ‘aT 급식관리단’ 발대식을 가졌다.aT 급식관리단은 농식품 유통 경험이 풍부한 aT 시니어직능클럽과 식품의약품안전처의 은퇴자들을 위원으로 위촉해 학교급식 현장 모니터링, 계도 등의 업무를 수행한다.aT는 안전한 학교급식 공급체계를 위해 유관기관 간 정보공유와 함께 지능형 입찰관제 시스템을 통해 공정한 급식 입찰을 만들어왔으며 경찰청과의 업무협약으로 부정당업체 수사협조 등 다양한 노력을 펼치고 있다.조해영 aT 유통이사는 “우리나라의 미래인 학생들이 먹는 급식은 식품 안전 중에서도 제일 중요하다”며 “업무 경험이 풍부한 은퇴 선배들이 사명감을 갖고 급식 관리를 위한 현장업무에 최선을 다해달라”고 밝혔다.조 유통이사는 학교급식 공급업체를 방문해 “aT는 유관기관 협조 체계 강화 등 안전한 학교 급식 식재료 공급의 한 축을 담당할 수 있도록 매진하겠다”고 밝혔다.한편 aT는 올해 학교급식 전담조직을 신설하며 학교급식 전자조달시스템(eaT)의 안전한 식재료 관리를 위한 상시 모니터링을 실시하고 있다. 현장 관리는 aT 급식관리단을 활용해 장기 경과 공급업체 대상 전수점검을 실시하고 이후 확대여부를 검토할 예정이다. ']"
740,가공식품 영양성분표시 중 소비자는 무엇을 확인할까?,http://www.aflnews.co.kr/news/articleView.html?idxno=144094,2018.05.14,"['\n소비자는 가공식품의 라벨에 표시된 영양 성분 중 주로 열량, 탄수화물, 포화지방 등을 확인하는 것으로 나타났다.반면 식품위생법에서 건강 위해 가능 영양성분으로 관리하고 있는 나트륨, 당류, 트랜스 지방 함량을 체크하는 소비자는 의외로 적었다.한국식품커뮤니케이션포럼에 따르면 양성범 단국대 환경자원경제학과 교수팀이 전국 성인남녀 331명을 대상으로 인터넷 설문조사를 실시한 결과 이 같이 드러났다.양 교수팀은 설문 대상자에게 쿠키류·캔디류·빵류 등 11개 식품군을 구입할 때 영양성분 의무표시 대상 중 주로 확인하는 항목이 무엇인지를 물었고, 영양성분 의무표시 대상 중 하나인 열량의 경우 11개 식품군 모두에서 소비자가 주로 확인하는 상위 3개 영양성분에 포함됐다.또한 탄수화물, 1회 제공량, 포화지방 함량은 각각 6개, 6개, 4개 식품군에서 소비자가 주로 확인하는 상위 3개 영양성분 중 하나였다.반면 식품의약품안전처가 건강 위해가능 영양성분으로 관리 중인 나트륨, 당류, 트랜스 지방 함량은 각각 2개 식품군에서만 상위 3개 영양성분에 포함됐다.영양성분 의무표시 대상인 칼슘, 비타민은 1개의 식품군에서도 소비자가 주로 확인하는 상위 3개 영양성분에 포함되지 않았다.양 교수는 “본 연구는 영양성분 의무표시 대상 전체를 일괄적으로 식품 라벨(영양 성분)에 표시토록 하는 현행 표시제도 대신 식품유형별 선택적 영양성분표시가 필요할 수 있다는 것을 시사한다”며 “나트륨, 당류, 트랜스 지방 등 건강 위해가능 영양성분의 섭취를 줄이기 위한 지속적인 식생활 교육과 홍보가 필요하다”고 밝혔다.한편 이번 설문 참여자는 나트륨 함량 정보표시의 개선방안으로 신호등 표시와 나트륨 함량 표시 병행 표시 도입(70.4%)을 가장 선호했다. 다음은 영양성분표시 크기 확대(14.8%), 나트륨 함량 단독 표시(9.4%), 나트륨 신호등 표시(5.4%)순이었다. ']"
741,"""GMO 완전표시제 유보…알권리 외면한 처사""",http://www.aflnews.co.kr/news/articleView.html?idxno=144093,2018.05.14,"['\n청와대가 최근 GMO(유전자 변형 농산물) 완전표시제를 촉구하는 국민청원에 대해 유보적으로 답한 것과 관련해 파장이 일고 있다.GMO 완전표시제를 주장했던 시민청원단은 이번 청와대의 답변에 대해 ‘국민의 목소리를 외면한 처사’라며 문재인 대통령의 사과와 지난 대통령 선거에서 공약으로 내걸었던 ‘GMO 표시제 강화’에 대한 조속한 이행을 촉구하고 나선 것이다.GMO 완전표시제 시민청원단은 지난 9일 청와대 앞 분수광장에서 ‘GMO 완전표시제 거부 청와대 답변 규탄 기자회견’을 갖고 “GMO 표시제도는 우리나라에만 있는 특수한 표시제도가 아닐 뿐더러 한국산, 중국산, 미국산 등 생산 국가를 명시하는 원산지 표시 제도와 같다”며 “청와대가 GMO 완전표시제로 인해 물가인상과 통상마찰이 우려된다는 입장을 밝혔지만 우리나라보다 강화된 GMO 표시제를 하고 있는 유렵, 미국, 호주, 일본 등은 물가 인상과 통상 마찰이 일어나지 않았다”고 꼬집었다.이들은 “정부는 세계화 현상으로 GMO가 무분별하게 생산·수입되면서 어떻게 생산됐는지 모르는 저가 수입 GMO 식품과 OEM(주문자 상표 부착방식)으로 생산한 수입 GMO 식품이 Non-GMO로 둔갑하는 것을 방지해 소비자 피해를 예방해야 한다”고 강조했다.시민청원단은 또 “프랑스는 GMO의 비의도적인 혼입을 감안해 2012년부터 Non-GMO 표시기준을 완화했으며, 일본시민사회에서는 유럽 방식의 표시 제도를 개정하자는 운동을 하고 있다”며 “핵심은 표시 대상을 단백질 잔류여부가 아니라 원료기반 표시로 바꾸고 비의도적 혼입치를 현행 5%에서 0.9%까지 낮춰야 한다”고 부언했다.이어 “문 대통령은 GMO 표시제 강화를 약속한 바 있지만 이번 청와대의 답변은 식품의약품안전처, 식품관련협회의 낡은 주장을 그대로 답습하고 있는 처사”라며 “GMO가 아닌지 알고자 하는 국민들의 기본적인 요구를 물가인상, 통상마찰이라는 오래된 거짓 근거로 외면한다면 문 정부가 박근혜 전 정부의 식품표시 정책을 계승하겠다는 선언으로 해석된다”고 덧붙였다. ']"
742,"기름기 적고 담백한 맛, 북태평양 자연산 홍연어를 주목하라!",http://www.aflnews.co.kr/news/articleView.html?idxno=146481,2018.05.05,"['\n컨템퍼러리\xa0퀴진 엘본더테이블(Elbon the table)을 운영하는 외식전문기업 엘본에프앤비가 캐나다 BC주의 북태평양 자연산 홍연어를 국내 최초로 론칭했다. 4월 24일 엘본에프앤비가 운영하는 컨템포러리 퀴진 엘본더테이블 가로수길 본점에서 리셉션을 주최했으며, 5월 17일 롯데 홈쇼핑 최유라쇼를 통해 캐나다 BC주 북태평양 청정 자연산 홍연어를  선보일 예정이다.\xa0강렬한 색감과 담백한 맛양식 연어에 비해 수입량이 적은 홍연어(Sockeye Salmon)는 100% 자연산 연어다. 다른 품종의 연어보다 짙은 붉은색을 띄는 이유는 바다 속 크릴과 새우 등을 주식으로 섭취해 생성된 아스타잔틴(astaxanthin) 색소가 더 강하기 때문이다. \xa0\xa0\xa0▲아스타잔틴 함유량이 높아 짙은 붉은색을 띄는 캐나다 BC주 홍연어 필렛.아스타잔틴은 강력한 항산화 효과로 최근 건강기능성 식품 시장에서 주목받고 있다. 항산화 수치인 ORAC(Oxygen Radial Absorbance Capacity)수치로 비교했을 때, 비타민C에 비해 6000배 가량 높은 항산화 효과를 나타낸다. 아스타잔틴은 미백, 주름 방지 효과와 노인성 황반병성 완화에 효과가 좋아 화장품의 원료로도 자주 사용된다. 눈 피로도와 건조함 개선에도 높은 효과를 보여 루테인과 함께 눈 건강에 좋은 영양소 중 하나다.  \xa0\xa0\xa0▲노해동 엘본더테이블 헤드셰프.아스타잔틴의 높은 함량 이외에 홍연어의 가장 큰 특징은 해류가 강한 북태평양의 특성 때문에 타 국가의 연어에 비해 지방 함유량이 적고 살이 단단하다는 점이다. 다른 국가의 연어는 지방 함유량이 높아 할 수 없는 요리들이 홍연어로는 시도 가능하다. 예를 들면 피시 앤 칩스로도 담백한 맛을 낼 수 있다. 엘본더테이블의 노해동 헤드 셰프는 “홍연어는 지방 함유량이 적고 살은 단단하지만 결은 부드럽다. 다른 품종의 연어로 할 수 없는 피시 앤 칩스와 같은 요리들을 할 수 있지만 요리할 때 결이 부서지지 않게 조심한다”고 말했다.\xa0\xa0\xa0▲노해동 엘본더테이블 헤드셰프가 개발한 아스파라거스를 곁들인 홍연어 스테이크.엘본에프앤비와 캐나다 대사관과 협업한 리셉션을 통해 노 헤드셰프는 홍연어 피시 앤 칩스와 훈제 홍연어 샐러드, 오징어 먹물 아란치니, 새우 빠삐요트, 과일 카나페, 아스파라거스를 곁들인 연어 스테이크 등 홍연어를 사용한 다양한 요리를 선보였다. 음료로는 캐나다 BC주의 특산품인 빙하수와 맥주, 커피가 제공됐다.\xa0▲엘본더테이블 가로수길 본점에서 진행된 캐나다 BC주 홍연어 론칭 기념 리셉션.수입식품 유통사업 시작하는 엘본에프앤비 엘본에프앤비는 5월 17일 최유라쇼를 통해 홍연어 필렛과 훈제 홍연어를 세트로 구성하여 판매할 예정이다. 홍연어 필렛은 완제품으로는 우리나라 최초 수입되어 첫 론칭하는 제품이다. 스테인레스 스틸 서빙 포크 스푼 세트와 이탈리아 엑스트라 버진 올리브 오일이 사은품으로 제공된다. 또한 엘본더테이블은 캐나다 BC주의 자연산 홍연어의 맛을 살린 신메뉴를 5월 중 판매 시작할 계획이다. 가로수길 본점 및 엘본더테이블 전 매장에서 홍연어를 만날 수 있다. \xa0유인석 엘본에프앤비 대표는 “한국\xa0전체 연어 수입량의 1%로 소량 수입되어 접하기 힘든 홍연어는 영양소와 품질 면에서 탁월하다. 이번 방송을 통해 많은 고객들이 새로운 맛을 경험하길 바란다”고 말했다. 이에 더해 유 대표는 ""이번 홍연어 론칭을 통해 엘본에프앤비가 수입식품 유통사업 시작할 것""이라고 말했다. 이후로도 엘본에프앤비는 엘본더테이블 브랜드 퀄러티에 맞는 제품들의 수입을 다양하게 추진할 계획이다. 롯데홈쇼핑 최유라쇼 홍연어 특집 방송은 5월 17일 오후 9시부터 40분 동안 방송될 예정이다.img {    max-width: 100%;     height: auto;    vertical-align: bottom;}권미현기자 ']"
743,매장탐방_ 현대백화점 킨텍스점 프리미엄 식품관,http://www.aflnews.co.kr/news/articleView.html?idxno=143930,2018.05.05,['\n']
744,MD추천 | 순식물성베이커리 더브레드블루,http://www.aflnews.co.kr/news/articleView.html?idxno=144534,2018.05.05,"['\n\xa0“더브레드블루는 순식물성 재료로 맛있고 건강한 빵들을 만듭니다. 비건 빵이면서도\xa0단순하지 않고 케이크, 밀푀유 등 다양한 시도를 하죠. 맛과 건강이라는 장점을 모두 가져 논비건 소비자들에게도 반응이 좋습니다.”\xa0- 김민영 헬로네이처 상품팀 MD\xa0▲문동진 더브레드블루 대표.\xa0더브레드블루는 순식물성 베이커리로 2012년 처음 문을 열 때부터 우유, 버터, 달걀을 사용하지 않은 빵을 판매하고 있다. 순식물성 재료로 만들어 낙농 제품을 섭취하지 않는 채식주의자인 비건도 먹을 수 있다. 서울 신촌과 서초동에 매장이 있고 구로동에 공장이 있으며 일부 롯데 프리미엄 푸드마켓에 입점했다. 빵은 무설탕 등 건강빵, 디저트, 단팥빵 등 기본 빵의 카테고리로 나뉘며 총 70여가지 빵이 있다. 치아바타, 통밀빵, 귀리빵, 열대과일로 단맛을 낸 건강빵, 도지마롤 등의 인기를 타고 매장 재방문율이 50~60%에 이른다. 2017년 말부터 매장을 확장하며 브랜드 강화에 박차를 가하고 있다.\xa0\xa0맛과 제조 능력 고루 갖춰\xa0더브레드블루는 크게 두 가지 경쟁력을 갖췄다.\xa0첫째, 더브레드블루는 선두주자다. 메뉴 개발을 담당하는 추영민 더브레드블루 총괄이사는 22년 경력의 제과장으로 2009년부터 비건빵 레시피를 연구했다. 문동진 더브레드블루 대표는 “국내 트렌드, 더브레드블루의 소비자 반응 등을 분석해 메뉴, 아이디어 등을 제안한다”고 말했다. 유통을 위한 제조시설도 따로 갖춰 헬로네이처에 납품할 수 있었다.\xa0둘째, 맛이다. 식감이 거친 건강빵부터 부드러운 디저트까지 다양한 빵을 판매한다. 일반 비건 베이커리보다 메뉴가 다양하며 폭넓은 시도를 한다. 헬로네이처에서 인기 있는 제품은 단호박 식빵이다. 식감이 부드럽고 단호박의 향이 은은한 점이 인기 요인이다. 단호박식빵 외에도 초코도지마롤, 맘모스빵, 사과가득 큐브식빵 등 총 8종이 입점했다.\xa0▶더브레드블루의 사가사각. 건조 후 크림에 버무린 영주사과 1개 분량(90g)이 들어있다. 헬로네이처에서는 ‘사과가득 큐브식빵’이라는 이름으로 판매중이다.\xa0문 대표는 헬로네이처에 입점해 소비자들의 반응을 직접 듣는 것이 큰 도움을 준다고 말했다. 마가린에 대한 소비자 반응을 예로 들었다. 더브레드블루는 우유는 두유, 달걀은 분리대두단백질, 버터는 쌀눈유로 대체한다. 헬로네이처 입점 후 소비자들이 다양한 우려를 표했다. 더브레드블루도 빵에 마가린을 사용하는지, 트랜스지방 문제는 없는지 등등 질문이 나왔다. 오프라인에서는 들을 수 없던 반응이었다.\xa0문 대표는 이 같은 반응들을 모든 빵에 즉각 반영했다. 완제품 뿐 아니라 원재료의 트랜스지방 함유량도 더욱 까다롭게 검사했다. 마가린을 사용한다면 쉽게 개발했을 레시피도 쌀눈유나 다른 식물성 오일로 제조하기 위해 거듭 연구하며 개발부터 출시 이후까지 소비자 피드백을 적극 반영한다.\xa0문 대표의 말이다.\xa0“비건 제품은 소비자들도 전문가입니다. 소비자 피드백을 통해 좋은 빵에 대한 연구가 한단계 더 성장할 수 있는 계기가 되었습니다.”\xa0\xa0대중적인 베이커리로 진화 중\xa0더브레드블루는 온라인 유통과 오프라인 판매 양방향으로 브랜드 강화를 모색하고 있다. 문 대표는 “헬로네이처에 입점된 빵들은 샘플 테스트를 거쳐 익일 배송되어도 맛에 큰 차이가 없다”고 말했다.\xa0▶오렌지필, 파파야 등으로\xa0맛을 낸 더브레드블루의\xa0건강빵 상큼한 4녀석들(위).\xa0더브레드블루의 인기 메뉴\xa0매운치아바타(아래).\xa0“매장에서 인기 있는 빵들 중 일부 빵은 다음날 먹으면 당일 판매하는 빵보다 식감이 떨어질 수밖에 없어요. 그 점이 늘 아쉬워요. 그래서 더욱 많은 빵들을 오프라인 매장의 식감을 그대로 느낄 수 있도록 유통용 제품 레시피를 개선하고 있습니다.”\xa0오프라인은 프랜차이즈화와 카페 프랜차이즈 납품을 고민하고 있다. 프랜차이즈화는 일반 대중을 상대로 하는 타 베이커리와 비교하면 순식물성 빵이라는 특색으로 차별점이 있다고 본다. 2017년 11월 문을 연 더브레드블루 서초점은 카페형 매장으로 두유, 아몬드브리즈로 만든 음료 등을 판매한다. 베이커리 단독 매장보다 카페와 결합한 매장이 더 경쟁력이 있으므로 음료와 햄버거, 샌드위치 등 즉석 조리 메뉴를 연구하고 있다. 빵을 직접 제조하지 않고 납품으로 해결하는 카페 프랜차이즈에 빵만 납품하는 것도 고려하고 있다.\xa0문 대표는 논비건 소비자도 포용할 수 있는 베이커리로 인식되길 바란다. 더브레드블루 신촌점은 중동, 유럽 등 외국인 소비자들이 많이 방문하는 곳으로도 유명하다.\xa0“건강을 위해서, 유당불내증이 있어서, 알레르기 때문에… 다양한 이유로 비건 빵에 관심을 갖는 소비자가 늘고 있습니다. 우리는 논비건 소비자에게도 쉽게 인식될 수 있도록 순식물성 베이커리로 어필하려 합니다.”\xa0김민영 헬로네이처 상품팀 MD는 “채식주의 마니아들을 주고객으로 출발했지만 점점 수요층이 넓어지는 추세”라며 순식물성 빵의 시장이 확산되고 있음을 암시했다.img {    max-width: 100%;     height: auto;    vertical-align: bottom;}이규민기자\xa0\xa0 ']"
745,"아이쿱자연드림 우리밀 잡채만두, 군 도입 시범사용 품목 선정",http://www.aflnews.co.kr/news/articleView.html?idxno=143900,2018.05.04,"['\n아이쿱자연드림 우리밀 잡채만두가 군 도입 가공식품류 우리밀 시범사용 품목에 선정돼 군대에서도 우리밀을 보다 가깝게 만날 수 있게 됐다.우리밀 시범사용 품목에 선정된 잡채만두는 100% 우리밀로 만든 만두피에 국산 고구마전분으로 만든 당면과 무항생제 돼지고기로 속을 채웠다. 구례자연드림파크에서 직접 원부재료 관리부터 생산, 포장까지 하고 있으며 쫄깃한 식감과 풍부한 속이 어우러져 자연드림 소비자 인기 상품으로 꼽힌다.잡채만두는 오는 7월경 일부 부대에 보급되며 이후 운영적합성 평가를 통해 전 군에 확대 보급이 결정될 예정이다.국방부는 민간 우수제품의 군 도입을 위한 목적으로 매년 반기별 1회 설명회를 개최하고 있으며 지난 2월 가공식품류 업체 설명회를 실시했다. 설명회에서는 식품 전문 기업에서 제안한 252개 가공식품 서류시사에서 선정된 100여개 제품이 전시됐으며 이 중 자연드림의 우리밀 잡채만두, 우리농촌살리기공동네트워크 부침가루가 선정됐다.군의 우리밀 제품 도입 결정은 우리밀 구곡 재고가 약 1톤이 남아있고 수입밀에 밀려 소비가 위축된 상황에서 우리밀 소비 확대의 길을 열고 있다는 점에서 가진 의미가 크다.아이쿱자연드림 관계자는 “현재 우리밀 자급율은 2016년 약 1.8%로 수입밀에 밀려 설자리를 잃고 있다”며 “우리밀 가공식품이 군 도입 시범사용 제품에 선정된 것은 우리밀 제품의 맛과 품질의 우수성을 인정 받은 결과”라고 밝혔다. ']"
746,"식약처, 가정의 달 대비 가정간편식 제조업체, 학교주변 식품 판매업소 점검",http://www.aflnews.co.kr/news/articleView.html?idxno=143899,2018.05.04,"['\n식품의약품안전처는 최근 가정의 달 대비 HMR(가정간편식), 배달음식점, 건강기능식품을 제조·판매하는 업체, 학교주변 식품 조리·판매업소 등을 17개 지방자치단체와 점검했다.도시락, 샌드위치, 즉석 죽 등 HMR 제조·판매업체, 프랜차이즈 음식점, 배달음식점 등 5076곳을 점검해 식품위생법을 위반한 118개 업체를 적발했다.적발된 업체는 가정간편식 제조업체 23개, 프랜차이즈 음식점 75개, 배달음식점 20개이며 주요 위반사항은 △유통기한 경과 제품 조리·판매 목적 보관(13개) △식품등의 위생적인 취급기준 위반(33개), △종사자 건강진단 미실시(34개) △시설기준 위반(8개) △기타(30개) 등이다.가정간편식으로 조리·판매되는 제품 1000개를 수거해 검사한 결과 검사가 완료된 903개 제품 중 김밥 2개 제품이 부적합으로 나와 폐기 조치했다.또한 부모님 효도 선물 등으로 제조·수입·유통·판매하는 건강기능식품을 제조·판매하는 업체 2781개를 점검해 △보존 및 유통기준(1개) △시설기준(12개)을 위반한 업체 13개를 적발했다.식약처는 분식점, 슈퍼마켓 등 학교주변 식품 조리·판매업소 총 3만1491개를 점검, 위반업소 10개를 적발, 시정 조치하고 있다.주요 위반내용은 △무신고 영업(1개) △유통기한 경과 제품 판매 목적 보관(6개) △위생적 취급기준 위반(1개) 등이다.\xa0 ']"
