,title,link,date,news
482,"식품연, 2019 패밀리기업 데이 열어",http://www.aflnews.co.kr/news/articleView.html?idxno=157426,2019.05.28,"['\n[농수축산신문=박현렬 기자]\xa0한국식품연구원은 최근 대회의실에서 2019 패밀리기업 데이 행사를 열고 코스맥스엔티비(주), ㈜넥스 등 신규 패밀리기업으로 선정된 11개 업체에게 지정서와 현판을 수여했다.패밀리기업은 국내 식품산업분야의 중소·중견기업을 대상으로 기업역량, 성장가능성, 보유기술 및 노하우의 경쟁력 등을 기준으로 엄격한 심사를 통해 부여된다.이번 신규지정으로 총 68개 기업으로 늘어났다.식품연은 패밀리기업을 대상으로 △연구개발·기술지원 사업 우선적 연구 참여 △애로사항에 대한 우선적 지원 △연구원 인증, 분석 서비스 및 장비 사용료 감면 △식품 박람회 등 홍보 전시 참가 등을 지원한다.특히 오는 11월 서울 코엑스에서 열리는 2019 서울국제식품산업전에서 패밀리기업관 및 홍보관을 공동으로 운영해 수출시장 개척 및 확대 등 혁신 시너지를 창출할 예정이다.박동준 식품연 원장은 “패밀리기업의 성장 기반과 식품연의 기술력이 만나 시너지를 창출할 때 국내 식품산업 발전뿐만 아니라 건강한 대한민국 실현에 기여할 수 있을 것으로 예상한다”며 “패밀리기업과 긴밀한 소통 및 협력관계를 통해 지원사업을 더욱 활성화하겠다”고 ']"
483,"식약처, 먹거리 정보산업 활성화 지원 나서",http://www.aflnews.co.kr/news/articleView.html?idxno=157401,2019.05.28,"['\n[농수축산신문=박현렬 기자]\xa0식품의약품안전처가 국민 누구나 쉽고 편리하게 활용할 수 있도록 식품안전 공공데이터를 개방하고 먹거리 정보산업 활성화 지원에 나선다.식약처는 회수대상 부적합 식품정보, 인허가 정보 등 131종의 공공데이터를 식품안전정보포털인 식품안전나라에 개방하고 스마트 냉장고·식품안전 모바일 앱 개발 등을 지원해 왔다.특히 온라인 기반 먹거리 시장이 확대됨에 따라 배달앱, 네이버 플레이스, 네이버 주문하기 등에 음식점 위생등급제, 행정처분정보를 제공하고 있으며 맛집 정보 제공 사이트로 대상을 확대할 계획이다.이와 관련 식약처는 국민이 체감하는 식품안전 공공데이터의 이용 활성화 방안을 논의하기 위해 식품업체, 앱 개발업체, 학계, IT 전문가 등이 참여하는 먹거리정보산업 민관협의체 회의를 지난 28일 개최한 바 있다.식약처는 민관협의체가 식품안전 공공데이터 공유 확대를 위한 소통창구가 될 것으로 기대하고 있으며 지속적인 의견수렴을 통해 다양한 식품안전정보를 발굴, 제공해 먹거리정보산업 분야의 새로운 부가가치 창출을 지원할 방침이다. ']"
484,국내 최대 규모 ‘2019 서울국제식품산업대전’ 열려,http://www.aflnews.co.kr/news/articleView.html?idxno=157081,2019.05.21,"['\n[농수축산신문=박현렬 기자]▲ 국내 최대 규모의 식품전시회인 2019 서울국제식품산업대전 개막식에 참석한 내외빈들이 테이프커팅을 하고 있다.전세계 40개국, 1532개 기업이 참가하는 국내 최대 규모의 식품전시회인 ‘2019 서울국제식품산업대전(서울푸드 2019)’이 지난 21~24일 일산 킨텍스에서 열렸다.올해 37회째를 맞는 ‘서울푸드 2019’는 식품 산업 전반의 글로벌 밸류체인 구축과 국내 중소·중견기업의 수출 지원을 목적으로 대한무역투자진흥공사(KOTRA) 주최로 개최되고 있다.행사는 식품과 식품기기 분야로 나눠 △서울국제농축수산물 및 가공식품전 △서울국제식품소재 및 첨가물전 △서울국제건강기능 및 유기농전 △서울국제디저트 및 음료전 △서울국제호텔&레스토랑 기기전 △서울국제포장기기전 △서울국제식품기기전 등이 마련됐다.특히 행사 첫날인 21일에는 개막 행사로는 ‘2019 글로벌 푸드 트렌드 & 테크 컨퍼런스’가 ‘발견, 모험을 즐기는 소비자’ 주제로 열렸다. ']"
485,2019 쌀가공식품산업대전 개최,http://www.aflnews.co.kr/news/articleView.html?idxno=156919,2019.05.17,"['\n[농수축산신문=서정학 기자]‘2019 쌀가공식품산업대전(RICE SHOW)’이 이달 21일부터 24일까지 일산 킨텍스(KINTEX)에서 개최된다.농림축산식품부 주최, (사)한국쌀가공식품협회 주관으로 열리는 이번 행사는 아시아 4대 식품전시인 서울국제식품산업대전(SEOUL FOOD)과 연계해 진행된다. 총 56개 쌀가공식품업체가 행사에 참가하며 쌀가공식품의 신기술·신제품을 선보일 예정이다.특히 올해 쌀가공식품산업대전은 ‘RICE SHOW LIFE PLUS’(우리 삶에 가치를 더하는 쌀가공식품)라는 슬로건으로 다양하게 변화하는 소비 트렌드에 맞춰 다양하게 진화된 쌀가공식품을 소개한다.쌀가공식품의 현황을 전하는 종합전시관(주제관)에서는 다양한 쌀가공식품을 마켓(Market)형태로 전시한다.기업관에서는 56개 쌀가공식품 제조업체가 참가, 국내·외 바이어에 새로운 쌀가공식품 가치를 소개하며 판로망 확충을 적극 타진할 수 있도록 한다.부대행사로는 쌀가공식품의 우수성을 참관객들에게 쉽게 전달하고자 김동기 셰프와 함께하는 ‘라이스 쿠킹쇼’, 제과기능장과 함께하는 ‘쌀빵데이’, 쌀토리 캐릭터 등과 함께하는 ‘라이스 캠페인’ 등을 진행한다.아울러 ‘2019년 쌀가공품 품평회’에서 선정된 ‘쌀가공품 Top10’ 제품도 전시할 예정이다. 이밖에도 쌀가공식품협회는 전시 전·후 참가 업체와 제품 정보를 확인할 수 있도록 온라인 전시관을 운영, 국내·외 바이어에 우수한 쌀가공식품의 정보를 상시적으로 전달하며 전시 효과를 배가한다는 입장이다.김남두 쌀가공식품협회장은 “라이스쇼가 우리 산업의 정보 교류의 장으로 자리매김하고 있는 상황에서 올해도 수출 판로를 확충하는 실질적인 비즈니스 성과 창출이 있길 기대한다”며 “중소 제조업체들의 여러 신제품도 확인하고 최신 쌀가공식품 현황도 소개하는 자리에 많은 분들이 참관하길 바란다”고 말했다. ']"
486,"쌀밥 1인 가구, 잡곡밥 다인가구 섭취 빈도 높아",http://www.aflnews.co.kr/news/articleView.html?idxno=156880,2019.05.17,"['\n[농수축산신문=박현렬 기자]쌀밥은 1인 가구, 잡곡밥은 다인가구에서 더 많이 섭취하는 것으로 나타났다.한국식품커뮤니케이션포럼에 따르면 정복미 전남대 교수팀이 2014~2016년 국민건강영양조사에 참여한 만 19~64세 성인 2만421명을 대상으로 가구 형태별 영양소 섭취량·식행동 등을 분석한 결과 이 같이 드러났다.1인 가구에서 매일 쌀밥을 1~3회 섭취하는 비율은 52%로 다인가구(39.3%)보다 높았다. 반면 1인 가구가 잡곡밥을 매일 1~3회 섭취하는 비율은 51.9%로 다인가구(66.2%) 대비 적었다.1인 가구가 다인가구 보다 잡곡밥을 덜 섭취하는 이유는 밥을 짓는데 잡곡을 불리는 시간이 오래 걸리기 때문이다.편의성·비용 등을 중시하는 1인 가구가 잡곡밥 보다 쌀밥을 더 자주 섭취하는 것이다.라면, 햄버거의 섭취 빈도는 1인 가구가 다인가구 대비 잦았으며 과일의 섭취 빈도는 다인가구가 많았다. 다인가구의 25%가 매일 1회 이상 과일을 섭취하지만 1인 가구의 하루 1회 이상 과일섭취율은 15%에 그쳤다.남성 1인 가구는 다인가구에 비해 식이섬유와 나이아신(비타민 B군의 일종) 섭취율은 낮은 반면 철 섭취율은 높았다. 20대 1인 가구는 20대 다인가구에 비해 아침 결식율은 높았으며 식이섬유 섭취도 적었다.정 교수팀은 “1인 가구를 대상으로 잡곡밥, 과일, 채소, 생선 등 건강에 이로운 식품 섭취를 위한 영양교육을 강화해야 한다”고 밝혔다. ']"
487,"아침 결식 청소년, 저녁 결식률 2배 높아",http://www.aflnews.co.kr/news/articleView.html?idxno=156715,2019.05.14,['\n[농수축산신문=박현렬 기자]아침을 결식하는 청소년이 저녁도 거를 가능성이 아침을 챙겨 먹는 또래에 비해 2배 이상 높은 것으로 나타났다. 또한 아침을 먹지 않는 청소년의 하루 칼로리 섭취량은 아침을 먹는 청소년보다 평균 400kcal 적었다.한국식품커뮤니케이션포럼에 따르면 차연수 전북대 교수팀이 2013~2015년 국민건강영양조사에 참여한 12~18세 청소년 1281명의 하루 식생활을 분석한 결과 이 같이 드러났다.차 교수팀은 연구 대상 청소년을 아침 결식 그룹과 아침 섭취 그룹으로 나눴는데 청소년의 아침 결식률은 29%에 달했다.아침 결식 그룹의 저녁식사 결식률은 12.1%로 아침 섭취 그룹(5.9%)보다 2배 이상 높았다.차 교수팀은 “저녁 결식은 야식 섭취로 이어져 다음달 아침 결식률을 높이는데 기여한다”며 “청소년의 아침 결식은 오전시간의 집중력 저하를 불러 학습능력과 성적을 낮출 수 있다”고 밝혔다.하루 평균 칼로리 섭취량은 아침 섭취 그룹이 2344kcal로 아침결식그룹(1936kcal)보다 400kcal 이상 많았다. 하루평균 단백질 섭취량은 아침 섭취 그룹(84g)과 아침 결식 그룹(68g)간 차이를 보였다. 하루 평균 채소 섭취량도 아침 섭취그룹(238g)이 결식 그룹(173g)보다 많았다.그러나 체질량을 근거로 한 비만율은 아침 결식 그룹(13.9%)이 섭취 그룹(10.9%)보다 높았다.차 교수팀은 “아침결식은 충동적인 간식 섭취로 지방 섭취를 증가시키고 다른 끼니의 과식을 유도해 비만을 초래할 수 있다”며 “청소년기에 섭취가 부족하기 쉬운 영양소인 칼슘·철 섭취량도 섭취그룹이 결식그룹에 비해 많았다”고 말했다. ']
488,"공정위, 임차인에 인테리어 비용 전가…홈플러스 과징금",http://www.aflnews.co.kr/news/articleView.html?idxno=156714,2019.05.14,"['\n[농수축산신문=박현렬 기자]공정거래위원회가 최근 매장 면적을 줄이고 신규 매장의 인테리어 비용 전부를 임차인에게 부담시킨 홈플러스(주)에게 시정명령(통지명령 포함)과 과징금 4500만원을 부과했다.공정위는 홈플러스가 구미점 내 4개 임대매장들의 위치·면적·시설을 변경하는 과정에서 계약기간이 남아있음에도 매장을 다른 곳으로 이동시키면서 임차인에게 불이익을 줬다고 밝혔다.홈플러스는 2015년 5~6월 구미점의 임대 매장을 전면적으로 개편하면서 27개 매장의 위치를 변경했다. 변경과정에서 4개 매장 임차인의 경우 기존 매장에 대한 계약기간이 남아있음에도 불구하고 사전에 충분한 협의나 적절한 보상 없이 기존 매장 보다 면적이 22~34% 줄어드는 곳으로 이동시켰으며 매장 변경에 따른 추가 인테리어 비용 전부를 부담하게 했다.공정위는 홈플러스의 행위는 계약기간 중에 정당한 사유 없이 매장 임차인에게 매장 위치·면적·시설을 변경하는 행위를 금지하고 있는 대규모유통업법 제17조 제8호에 위반된다고 밝혔다.공정위 관계자는 “계약기간 중 납품업자 또는 임차인의 매장 위치·면적·시설을 변경하는 것은 정당한 사유가 있는 경우에 한해 허용되는 것으로 관련 변경 기준 및 협의 내용을 문서로 보존해야 한다”며 “매장 변경은 납품업자나 임차인과의 충분한 사전 협의를 통해 자발적인 동의로 이뤄져야 하며 변경 이유와 변경에 따른 이익, 손실, 필요한 보상에 대해 판단할 수 있는 객관적 변경 기준이 제시돼야 한다”고 밝혔다.공정위는 대형마트 주도하에 전체 매장을 개편하면서 사전에 충분한 협의나 적절한 보상 없이 기존 임차인의 매장 위치·면적을 불리하게 변경시키고, 그에 따른 추가 인테리어 비용까지전부 임차인에게 부담시키는 불공정한 관행을 더 이상 허용하지 않겠다는 입장이다. ']"
489,"식약처, 식품 표시 규정·식품공전 설명회 개최",http://www.aflnews.co.kr/news/articleView.html?idxno=156713,2019.05.14,"['\n[농수축산신문=박현렬 기자]식품의약품안전처는 식품 생산·제조·수입·유통 영업자와 담당공무원을 대상으로 ‘식품등의 표시 규정 및 기준·규격 설명회’를 이달 17일부터 오는 31일까지 전국 6개 지역(서울, 부산, 대전, 광주, 대구, 제주)에서 개최한다.본 설명회에서는 최근 시행된 식품 등의 표시·광고에 관한 법률의 법령 체계와 법에 따라 금지되는 표시·광고 행위 유형 등을 소개하고 식품 등의 표시기준, 식품의 기준 및 규격 주요 개정 내용도 함께 설명한다.설명회는 참석자 접근 편의를 고려해 지역별로 개최되며 17일 부산(상공회의소), 21일 대전(통계교육원), 22일 서울(마포구청), 24일 제주(도청 제2청사), 31일 대구(상공회의소)와 광주(김대중컨벤션센터) 순으로 진행된다.식약처 관계자는 “식품 관련 영업자와 공무원에게 도움이 될 것으로 기대한다”며 “식품 등의 표시 규정과 식품공전 관련 정보를 지속적으로 제공하겠다”고 밝혔다.설명회 참석은 편리한 시간과 장소에서 사전등록 없이 누구나 참여할 수 있다. ']"
490,식품 안전성 강화한 식량안보 확대해야,http://www.aflnews.co.kr/news/articleView.html?idxno=156680,2019.05.14,"['\n[농수축산신문=이한태 기자]\xa0▲ 김덕호 농식품부 식품산업정책관은 ‘식품산업의 식량안보 기능 확대를 위한 방안’ 주제발표를 통해 식품산업과 연계한 식량안보 방안에 대해 설명했다.식량안보의 중요성이 높아지고 있는 가운데 농업 생산성뿐만 아니라 식품의 안전성을 강화하는 방향으로 식량안보를 확대해야 한다는 주장이 제기됐다.한국식량안보연구재단과 한국식품산업협회는 지난 10일 한국프레스센터에서 ‘식품산업의 식량안보기능’을 주제로 2019년 식품안전의 날 기념 심포지엄을 개최했다.이날 참석자들은 식량안보에서 중요한 것은 단순히 먹을거리를 많이 쌓아두는데 그치는 것이 아니라 안전한 먹을거리를 생산·공급하는데 있다고 강조했다.권오란 이화여대 식품영양학과 교수는 ‘식품안전관리의 식량안보 기능’ 주제발표를 통해 “식량안보의 궁극적인 목표는 국민의 영양과 건강유지에 있다”며 “이를 위해 식량자급률의 양적인 측면과 식품안전 등의 질적인 측면이 모두 고려돼야 한다”고 말했다.이어 권 교수는 “현재 현장과 정책의 식품안전관리의 이행가능성이 저하되고 식품안전 사고 발생 시 부처간 장벽으로 신속대응이 어려운 상황이다”며 “선결조건인 현장에 대한 이해를 제고하기 위해 소통을 확대하고 현장 중심 관리체계를 구축해야 한다”고 말했다.농림축산식품부에서도 식품산업과 연계한 식량안보 방안을 소개했다.김덕호 농식품부 식품산업정책관은 ‘식품산업의 식량안보 기능 확대를 위한 방안’ 주제발표에서 “식품과 관련한 R&D(연구개발)와 기술활용으로 식량안보 기능을 강화해야 한다”며 “농업·농촌의 가치와 연계한 식생활 교육을 추진하고, 농촌융복합산업 핵심 경영체를 집중 육성하는 동시에 외식업 활성화 지원, 민관협업을 통한 한식진흥 등 식품산업계의 경영여건 개선과 성과제고를 통해 식량안보에 기여할 계획이다”고 말했다.이철호 한국식량안보연구재단 이사장은 “식품안전은 식량안보를 확보하는데 가장 중심적인 사안이다”며 “식품안전에 대한 과학적 평가와 올바른 인식은 식품의 낭비를 줄이고, 식량자원을 원활히 확보하는 필수적인 요소”라고 강조했다. ']"
491,"일본젊은이들, 우리나라 매운맛 홀릭",http://www.aflnews.co.kr/news/articleView.html?idxno=156663,2019.05.14,"['\n[농수축산신문=박현렬 기자]\xa0떡볶이, 닭갈비 등 우리나라 매운맛에 일본 젊은이들이 흠뻑 빠졌다.농림축산식품부와 한국농수산식품유통공사(aT)는 지난 11일부터 이틀간 일본 오사카 중심지인 우메다 일대에서 푸드트럭을 활용한 한국 농식품 홍보행사를 펼쳤다.본 행사는 최근 급성장 중인 일본의 HMR(가정간편식) 시장을 겨냥해 폭발적으로 인기를 끌고 있는 한국 핫도그와 치즈닭갈비, 김치전 등 우리나라 식재료를 활용한 즉석요리를 선보이고자 열렸다. 홍보행사에는 약 3500명의 일본 소비자가 참여했다.현지 소비자들은 “한국 떡볶이는 맵지만 자꾸 손이 가는 중독성이 강한 매운 맛”이라고 말했다. 이번 행사를 통해 정치적으로 냉랭한 한일관계와는 대조적으로 일본 젊은 층의 K-FOOD 열기를 엿볼 수 있었다.신현곤 aT 식품수출이사는 “예전에는 일본 중년 여성들이 한류의 중심이었으나 최근에는 젊은 층 사이에서 새롭게 한류가 퍼지고 있다”며 “Hot&Red를 테마로 한 매운맛 라면, 떡볶이, 김치, 식초음료 등 새로운 한국의 맛을 알릴 계획”이라고 밝혔다.\xa0 ']"
492,매장탐방 | 한국야쿠르트 카페 ‘하이프레시’ 롯데백화점 일산점,http://www.aflnews.co.kr/news/articleView.html?idxno=157527,2019.05.05,"['\n국내 최초 한국야쿠르트 카페 ‘하이프레시’ 매장이 3월 29일 롯데백화점 일산점 지하 2층에 문을 열었다. 이 매장에는 발효유부터 밀키트까지, 요즘 잘 나가는 야쿠르트 제품들을 한자리에 모았다.']"
493,2019 푸드페스타,http://www.aflnews.co.kr/news/articleView.html?idxno=156610,2019.05.05,['\n']
494,이달 식중독 유의해야,http://www.aflnews.co.kr/news/articleView.html?idxno=156379,2019.05.02,"['\n[농수축산신문=박현렬 기자]\xa0야외행사가 많은 이달 도시락 등에 대한 식중독 발생 우려가 높아 식음료·보관·섭취에 각별한 주의가 요구된다.식품의약품안전처는 최근 5년간 식중독 발생 현황 분석 결과 봄철(4~6월) 식중독 발생이 연간 평균 98건이며 전체 식중독 환자의 28%가 이 기간에 발생했다고 밝혔다.식중독 환자 발생은 일교차가 크고 야외활동으로 장시간 음식물을 방치하는 등 식품 보관, 섭취, 개인위생에 대한 관리 부주의 때문이다.기상청이 이달부터 오는 7월까지 평년보다 평균기온이 높거나 비슷할 것으로 예측하고 있어 일찍 찾아온 더위로 병원성대장균 등 식중독균에 의한 식중독 발생이 증가할 전망이다.식약처는 도시락 준비 요령에 대해 △조리 전 비누 등 세정제를 사용해 30초 이상 손 씻기 △과일·채소류 등은 물에 담갔다가 흐르는 물로 깨끗이 씻기 △조리 음식은 중심부까지 완전히 익히기 △음식은 1회 식사량만큼 준비하고 밥과 반찬은 식힌 후 별도 용기에 따로 담기 △김밥을 준비할 경우 밥과 재료들을 충분히 식힌 후에 만들어야 한다고 설명했다.도시락 보관 및 운반 요령은 △조리된 식품은 실온에서 2시간 이상 방치하지 않기 △가급적 아이스박스 등을 이용해 10도 이하에서 보관·운반 △햇볕이 닿는 공간이나 자동차 트렁크에 보관하지 않기 등이다.도시락을 섭취할 때는 △식사 전 손을 깨끗이 씻거나 물티슈로 닦기 △실온이나 자동차 트렁크에서 오래 보관됐던 식품은 과감히 버리기 △마실 물은 가정에서 미리 준비하고 안전성이 확인되지 않은 계곡물이나 샘물 등은 함부로 마시지 않아야 한다.식약처는 음식물 취급과 섭취에 조금만 주의를 기울이면 안전하고 즐거운 나들이가 될 것으로 기대하며 평소 식중독예방 3대 요령인 손 씻기, 익혀 먹기, 끓여 먹기 실천을 당부했다. ']"
495,[이슈] 봄에 열리는 햇김치 축제 이목 집중,http://www.aflnews.co.kr/news/articleView.html?idxno=156197,2019.04.30,"['\n[농수축산신문=박현렬 기자]\xa0늦가을 이후 김장철에 집중됐던 김치축제가 처음으로 봄에 마련돼 봄배추, 미나리, 냉이, 다래, 취나물, 머위 등 다양한 푸성귀들을 이용한 김치가 소비자들의 이목을 집중시킬 전망이다.다음달 3일부터 4일까지 서울시청 앞 광장에서 ‘광주 햇김치 서울나들이’라는 슬로건으로 열리는 김치축제는 광주세계김치축제위원회가 주관하고 (사)한국음식인문화연구원이 후원한다.그간 김치와 관련된 축제들은 모두 늦가을 이후 김장철에 집중돼 각 지자체들 간에 불필요한 경쟁이 발생하고 참여하는 내·외국인 관광객 및 김치 소비자들 입장에서도 선택의 폭을 좁히는 등 문제점과 한계가 지적돼왔다.뿐만 아니라 김치에 대한 관심과 수요가 김장철에 집중돼 김치산업과 김치문화 활성화에도 도움이 되지 못했다.2019 광주 햇김치 서울나들이는 김치문화를 선도하는 김치 광주의 이미지를 공고히해 지역 김치산업 발전의 계기가 될 것으로 전망된다.이번 축제에서는 봄에 담그는 햇김치 20여종과 광주김치명인들의 명품김치 12종이 전시되는 광주 햇김치와 명인김치 전시관, 스타 셰프 미카엘과 김치명인들이 함께 하는 햇김치 시연 및 체험관, 광주김치 홍보전시관 및 광주 햇김치 판매관, 옹기와 발효식품 전시관으로 구성된다.다음달 3일 개막식에는 국내 최초로 외국인 김치홍보대사 위촉, 김치사랑가 발표 공연, 햇김치 톡톡 팝페라 및 뮤지컬 공연 등 다양한 부대행사가 열린다.직접 김치를 만들고 구매하는 체험 프로그램은 대통령 표창을 받은 광주 김치명인들이 함께 하며 유료 프로그램으로 매 시간 20명씩 선착순으로 접수한다. 장소는 행사장 무대 옆 체험관이다.행사 관련 문의와 안내, 김치담기 체험프로그램 참여 신청은 광주햇김치축제 홈페이지(kimchi.gwangju.go.kr)를 통해 가능하다.\xa0 ']"
496,"대상(주) 종가집, 2019 봄김장 나눔행사",http://www.aflnews.co.kr/news/articleView.html?idxno=155972,2019.04.23,"['\n[농수축산신문=박현렬 기자]\xa0대상(주) 종가집이 23일 서울 중구 남산 한옥마을에서 ‘2019 종가집 봄김장 나눔행사’를 실시했다.본 행사에는 임정배 대상 대표이사, 권용석 상무, 정연보 서울특별시 사회복지협의회장, 김원이 서울시 정무부시장을 비롯한 대상 임직원들과 청정원 대학생 자원봉사단, 청정원 주부봉사단 등 총 200여명이 참여했다.종가집 봄김장 나눔은 겨울에 담근 김장 김치가 떨어지기 시작하는 봄에 진행하는 대상 종가집의 대표적인 사회공헌 활동이다. 겨울엔 다양한 나눔 행사들이 이어져 김치 지원 역시 원활한 반면 김치가 동이 나는 시기인 봄에는 상대적으로 먹거리 지원이 부족하기 때문에 소외이웃들이 걱정 없이 김치와 반찬을 먹을 수 있도록 봄김장 행사를 진행하고 있다.행사 참가자들은 종가집 김치와 한우곰탕 등 총 9종의 반찬류 제품으로 구성된 나눔박스 2019개를 현장에서 직접 제작해 전국의 저소득층 이웃에게 전달했다.이보라 사회공헌팀장은 “봄철 이후에 어려운 이웃들이 걱정 없이 김치와 반찬을 먹을 수 있도록 종가집 봄김장 나눔 행사를 진행한다”며 “나눔박스를 통해 건강하고 행복한 식생활을 도울 수 있기를 기대한다”고 밝혔다.대상은 서울시 푸드뱅크의 사업 첫 해인 1998년부터 현재까지 꾸준히 후원하고 있으며 나무나누기와 헌혈행사, 연말 세트제작까지 다양한 나눔 봉사활동을 진행하고 있다. ']"
